<?xml version="1.0" encoding="UTF-8" standalone="no"?>
<?xml-stylesheet type="text/css" href="stylesheet.css"?>

<root xmlns="http://www.example.org/types"
xmlns:xsi="http://www.w3.org/2001/XMLSchema-instance" 
xsi:schemaLocation="http://www.example.org/types BookStore.xsd">
    <info>
        <owners>
            <owner>Bartosz Kacperski</owner>
            <owner>Paweł Pomarański</owner>
        </owners>
        <description>
            Dokument zawiera katalog książek w bibliotece
        </description>
    </info>
    <bookstore>
        <authors>
            <author authorId="a1">
                <firstName>Stephen</firstName>
                <lastName>King</lastName>
                <pseudonym>Richard Bachman</pseudonym>
            </author>
            <author authorId="a2">
                <firstName>Arthur</firstName>
                <firstName>Conan</firstName>
                <lastName>Doyle</lastName>
            </author>
            <author authorId="a3">
                <firstName>Harlan</firstName>
                <lastName>Coben</lastName>
            </author>
        </authors>
        <books>
            <book bookId="b1" authorId="a1" category="dramat" pages="200" rating="brak">
                <title>17 podniebnych koszmarów</title>
                <releaseDate>
                    <year>1996</year>
                    <month>--02</month>
                    <day>---19</day>
                </releaseDate>
            </book>
            <book bookId="b2" authorId="a1" category="horror" rating="2">
                <title>999 tom 1</title>
                <releaseDate>
                    <year>1977</year>
                    <month>--05</month>
                    <day>---21</day>
                </releaseDate>
            </book>
            <book bookId="b3" authorId="a1" category="horror" pages="364" rating="brak">
                <title>Arcydzieła czarnego kryminału</title>
                <releaseDate>
                    <year>1977</year>
                    <month>--05</month>
                    <day>---21</day>
                </releaseDate>
            </book>
            <book bookId="b4" authorId="a1" category="horror" rating="4">
                <title>Ballada o celnym strzale</title>
                <releaseDate>
                    <year>1977</year>
                    <month>--05</month>
                    <day>---21</day>
                </releaseDate>
            </book>
            <book bookId="b5" authorId="a1" category="horror" rating="brak">
                <title>Bastion</title>
                <releaseDate>
                    <year>1977</year>
                    <month>--05</month>
                    <day>---21</day>
                </releaseDate>
            </book>
            <book bookId="b6" authorId="a1" category="horror" rating="2">
                <title>Bazar złych snów</title>
                <releaseDate>
                    <year>1977</year>
                    <month>--05</month>
                    <day>---21</day>
                </releaseDate>
            </book>
            <book bookId="b7" authorId="a1" category="horror" rating="brak">
                <title>Bezsenność</title>
                <releaseDate>
                    <year>1977</year>
                    <month>--05</month>
                    <day>---21</day>
                </releaseDate>
            </book>
            <book bookId="b8" authorId="a1" category="horror" rating="1">
                <title>Buick 8</title>
                <releaseDate>
                    <year>1977</year>
                    <month>--05</month>
                    <day>---21</day>
                </releaseDate>
            </book>
            <book bookId="b9" authorId="a1" category="horror" rating="4">
                <title>Carrie</title>
                <releaseDate>
                    <year>1977</year>
                    <month>--05</month>
                    <day>---21</day>
                </releaseDate>
            </book>
            <book bookId="b10" authorId="a1" category="horror" rating="brak">
                <title>Christine</title>
                <releaseDate>
                    <year>1977</year>
                    <month>--05</month>
                    <day>---21</day>
                </releaseDate>
            </book>
            <book bookId="b11" authorId="a1" category="horror" rating="4">
                <title>Cmętarz zwieżąt</title>
                <releaseDate>
                    <year>1977</year>
                    <month>--05</month>
                    <day>---21</day>
                </releaseDate>
            </book>
            <book bookId="b12" authorId="a1" category="horror" rating="brak">
                <title>Czarnoksiężnik i kryształ</title>
                <releaseDate>
                    <year>1977</year>
                    <month>--05</month>
                    <day>---02</day>
                </releaseDate>
            </book>

            <book bookId="b13" authorId="a1" category="akcja" rating="2">
                <title>Sherlock Holmes</title>
                <releaseDate>
                    <year>2001</year>
                    <month>--12</month>
                    <day>---25</day>
                </releaseDate>
            </book>

            <book bookId="b14" authorId="a3" category="kryminał" rating="brak">
                <title>Już mnie nie oszukasz</title>
                <releaseDate>
                    <year>2016</year>
                    <month>--12</month>
                    <day>---25</day>
                </releaseDate>
            </book>
            <book bookId="b15" authorId="a3" category="powieść" rating="5">
                <title>Aż śmierć nas rozłączy</title>
                <releaseDate>
                    <year>1999</year>
                    <month>--02</month>
                    <day>---22</day>
                </releaseDate>
            </book>
            <book bookId="b16" authorId="a3" category="powieść" rating="3">
                <title>Bez pożegnania</title>
                <releaseDate>
                    <year>1999</year>
                    <month>--02</month>
                    <day>---03</day>
                </releaseDate>
            </book>
            <book bookId="b17" authorId="a3" category="powieść" rating="1">
                <title>Aż śmierć nas rozłączy</title>
                <releaseDate>
                    <year>1999</year>
                    <month>--02</month>
                    <day>---22</day>
                </releaseDate>
            </book>
            <book bookId="b18" authorId="a3" category="powieść" rating="2">
                <title>Bez skrupułów</title>
                <releaseDate>
                    <year>1999</year>
                    <month>--02</month>
                    <day>---22</day>
                </releaseDate>
            </book>
            <book bookId="b19" authorId="a3" category="powieść" rating="5">
                <title>Bez śladu</title>
                <releaseDate>
                    <year>1999</year>
                    <month>--02</month>
                    <day>---22</day>
                </releaseDate>
            </book>
            <book bookId="b20" authorId="a3" category="powieść" rating="brak">
                <title>Błękitna krew</title>
                <releaseDate>
                    <year>1999</year>
                    <month>--02</month>
                    <day>---22</day>
                </releaseDate>
            </book>
        </books>
    </bookstore>
</root>

